{
  "_type": "https://in-toto.io/Statement/v1",
  "subject": [
    {
      "name": "linux-x64/helmd",
      "digest": { "sha256": "a3f5e1c9b2d4f6a8c0e2b4d6f8a0c2e4b6d8f0a2c4e6b8d0f2a4c6e8b0d2f4a6" },
      "size": 84213760
    },
    {
      "name": "macos-arm64/helmd",
      "digest": { "sha256": "b4a6f2c0d3e5f7a9c1e3b5d7f9a1c3e5b7d9f1a3c5e7b9d1f3a5c7e9b1d3f5a7" },
      "size": 79102432
    },
    {
      "name": "windows-x64/helmd.exe",
      "digest": { "sha256": "c5b7a3d1e4f6a8c0e2b4d6f8a0c2e4b6d8f0a2c4e6b8d0f2a4c6e8b0d2f4a6c8" },
      "size": 88451072
    }
  ],
  "predicateType": "https://ainumbers.co/helm/attestation/v1#release-manifest",
  "predicate": {
    "version": "0.1.0",
    "node_version": "v22.5.0",
    "platforms": ["linux-x64", "macos-arm64", "windows-x64"]
  }
}
